{
  "schema_version": 1,
  "diagram_type": "architecture",
  "meta": {
    "title": "Bước 5: HTTP/2 stream",
    "output": ".archify/youtube/grpc-how-it-works-20260930-164021/2-http2-stream/http2-stream.html",
    "quality_profile": "showcase",
    "animation": "trace",
    "viewBox": [
      1200,
      760
    ],
    "legend": {
      "mode": "hidden"
    }
  },
  "components": [
    {
      "id": "conn",
      "type": "cloud",
      "label": "HTTP/2",
      "pos": [
        60,
        300
      ],
      "size": [
        220,
        110
      ],
      "tile": true,
      "sublabel": "one connection"
    },
    {
      "id": "st1",
      "type": "messagebus",
      "label": "Stream 1",
      "pos": [
        380,
        110
      ],
      "size": [
        170,
        90
      ],
      "tile": true,
      "sublabel": "RPC call"
    },
    {
      "id": "st2",
      "type": "messagebus",
      "label": "Stream 2",
      "pos": [
        380,
        335
      ],
      "size": [
        170,
        90
      ],
      "tile": true
    },
    {
      "id": "st3",
      "type": "messagebus",
      "label": "Stream 3",
      "pos": [
        380,
        560
      ],
      "size": [
        170,
        90
      ],
      "tile": true
    },
    {
      "id": "frame",
      "type": "messagebus",
      "label": "Data frame",
      "pos": [
        700,
        110
      ],
      "size": [
        200,
        90
      ],
      "tile": true,
      "sublabel": "Protobuf message"
    },
    {
      "id": "prefix",
      "type": "messagebus",
      "label": "5-byte prefix",
      "pos": [
        960,
        110
      ],
      "size": [
        200,
        90
      ],
      "tile": true,
      "sublabel": "1 flag + 4 length"
    },
    {
      "id": "post",
      "type": "external",
      "label": "POST",
      "pos": [
        60,
        560
      ],
      "size": [
        220,
        100
      ],
      "tile": true,
      "sublabel": "every call"
    }
  ],
  "connections": [
    {
      "id": "e-c1",
      "from": "conn",
      "to": "st1",
      "fromSide": "right",
      "toSide": "left"
    },
    {
      "id": "e-c2",
      "from": "conn",
      "to": "st2",
      "fromSide": "right",
      "toSide": "left"
    },
    {
      "id": "e-c3",
      "from": "conn",
      "to": "st3",
      "fromSide": "right",
      "toSide": "left"
    },
    {
      "id": "e-f",
      "from": "st1",
      "to": "frame",
      "label": "message",
      "fromSide": "right",
      "toSide": "left",
      "variant": "emphasis"
    },
    {
      "id": "e-p",
      "from": "frame",
      "to": "prefix",
      "fromSide": "right",
      "toSide": "left"
    },
    {
      "id": "e-post",
      "from": "post",
      "to": "conn",
      "label": "method",
      "fromSide": "top",
      "toSide": "bottom"
    }
  ]
}