{
  "schema_version": 1,
  "diagram_type": "architecture",
  "meta": {
    "title": "Bước 6-11: server decode, chạy, encode",
    "output": ".archify/youtube/grpc-how-it-works-20260930-164021/3-server-side/server-side.html",
    "quality_profile": "showcase",
    "animation": "trace",
    "viewBox": [
      1200,
      760
    ],
    "legend": {
      "mode": "hidden"
    }
  },
  "components": [
    {
      "id": "transport",
      "type": "cloud",
      "label": "HTTP/2",
      "pos": [
        40,
        300
      ],
      "size": [
        190,
        100
      ],
      "tile": true
    },
    {
      "id": "payment",
      "type": "backend",
      "label": "Payment service",
      "pos": [
        350,
        300
      ],
      "size": [
        190,
        100
      ],
      "tile": true,
      "sublabel": "gRPC server"
    },
    {
      "id": "protobuf",
      "type": "backend",
      "label": "Protobuf",
      "pos": [
        660,
        300
      ],
      "size": [
        190,
        100
      ],
      "tile": true,
      "sublabel": "decode"
    },
    {
      "id": "app",
      "type": "backend",
      "label": "Server app",
      "pos": [
        970,
        300
      ],
      "size": [
        190,
        100
      ],
      "tile": true
    }
  ],
  "connections": [
    {
      "id": "e-in",
      "from": "transport",
      "to": "payment",
      "label": "bytes",
      "fromSide": "right",
      "toSide": "left"
    },
    {
      "id": "e-dec",
      "from": "payment",
      "to": "protobuf",
      "label": "decode",
      "fromSide": "right",
      "toSide": "left",
      "variant": "emphasis"
    },
    {
      "id": "e-inv",
      "from": "protobuf",
      "to": "app",
      "label": "invoke",
      "fromSide": "right",
      "toSide": "left"
    },
    {
      "id": "e-enc",
      "from": "app",
      "to": "protobuf",
      "label": "encode",
      "fromSide": "bottom",
      "toSide": "bottom"
    },
    {
      "id": "e-back",
      "from": "protobuf",
      "to": "transport",
      "label": "bytes back",
      "fromSide": "bottom",
      "toSide": "bottom"
    }
  ]
}