{
 "schema_version": 1,
 "diagram_type": "architecture",
 "meta": {
  "title": "Load Balancer: Overview",
  "subtitle": "One entry point, six jobs",
  "output": "0-overview.html",
  "quality_profile": "showcase",
  "animation": "trace",
  "viewBox": [
   400,
   711
  ],
  "legend": {
   "mode": "hidden"
  }
 },
 "components": [
  {
   "id": "clients",
   "type": "external",
   "label": "Clients",
   "sublabel": "Mobile · Desktop · Returning",
   "pos": [
    95,
    20
   ],
   "size": [
    210,
    90
   ],
   "tile": true,
   "note": "Three kinds of callers: the native mobile app, the desktop web app, and returning users carrying a session cookie."
  },
  {
   "id": "health",
   "type": "security",
   "label": "Health Checker",
   "sublabel": "probes instances",
   "pos": [
    8,
    170
   ],
   "size": [
    112,
    100
   ],
   "tile": true,
   "note": "Probes every backend instance and removes any that fail from routing until they recover."
  },
  {
   "id": "lb",
   "type": "cloud",
   "label": "Load Balancer",
   "sublabel": "L7 · HTTPS :443",
   "pos": [
    148,
    170
   ],
   "size": [
    104,
    100
   ],
   "tile": true,
   "note": "Terminates inbound HTTPS, routes each request by platform, skips unhealthy instances and keeps returning users on the same server."
  },
  {
   "id": "session",
   "type": "database",
   "label": "Session Store",
   "sublabel": "sticky session map",
   "pos": [
    280,
    170
   ],
   "size": [
    112,
    100
   ],
   "tile": true,
   "note": "Remembers which instance owns each session so a returning user is pinned back to it."
  },
  {
   "id": "mobile-pool",
   "type": "backend",
   "label": "Mobile Pool",
   "sublabel": "light API payloads",
   "pos": [
    15,
    370
   ],
   "size": [
    175,
    90
   ],
   "tile": true,
   "note": "Backend pool tuned for mobile API traffic, served from Zone A."
  },
  {
   "id": "web-pool",
   "type": "backend",
   "label": "Web Pool",
   "sublabel": "full-page responses",
   "pos": [
    210,
    370
   ],
   "size": [
    175,
    90
   ],
   "tile": true,
   "note": "Backend pool that renders full web pages for desktop, served from Zone B."
  },
  {
   "id": "zone-a",
   "type": "backend",
   "label": "Zone A",
   "sublabel": "3 instances · 1 unhealthy",
   "pos": [
    15,
    570
   ],
   "size": [
    175,
    90
   ],
   "tile": true,
   "note": "Availability Zone A: instances A1 and A2 are healthy; A3 failed its health probe and is out of rotation.",
   "icon": "messagebus"
  },
  {
   "id": "zone-b",
   "type": "backend",
   "label": "Zone B",
   "sublabel": "2 instances · healthy",
   "pos": [
    210,
    570
   ],
   "size": [
    175,
    90
   ],
   "tile": true,
   "note": "Availability Zone B: instances B1 and B2 are healthy and give cross-zone capacity if Zone A degrades.",
   "icon": "messagebus"
  }
 ],
 "connections": [
  {
   "id": "c-lb",
   "from": "clients",
   "to": "lb",
   "label": "HTTPS",
   "variant": "security"
  },
  {
   "id": "lb-health",
   "from": "lb",
   "to": "health"
  },
  {
   "id": "lb-session",
   "from": "lb",
   "to": "session"
  },
  {
   "id": "lb-mobile",
   "from": "lb",
   "to": "mobile-pool",
   "label": "mobile"
  },
  {
   "id": "lb-web",
   "from": "lb",
   "to": "web-pool",
   "label": "web"
  },
  {
   "id": "mp-a",
   "from": "mobile-pool",
   "to": "zone-a"
  },
  {
   "id": "wp-b",
   "from": "web-pool",
   "to": "zone-b"
  }
 ],
 "cards": [
  {
   "dot": "cyan",
   "title": "Overview",
   "items": [
    "One load balancer terminates TLS, routes by platform, avoids unhealthy servers and keeps returning users on the same instance."
   ]
  }
 ]
}