{
  "schema_version": 1,
  "diagram_type": "architecture",
  "meta": {
    "title": "gRPC: REST ở hai đầu, gRPC ở giữa",
    "output": ".archify/youtube/grpc-how-it-works-20260930-164021/0-overview/overview.html",
    "quality_profile": "showcase",
    "animation": "trace",
    "viewBox": [
      1200,
      760
    ],
    "legend": {
      "mode": "hidden"
    }
  },
  "components": [
    {
      "id": "client",
      "type": "frontend",
      "label": "Client",
      "pos": [
        60,
        300
      ],
      "size": [
        220,
        110
      ],
      "tile": true,
      "sublabel": "REST · JSON"
    },
    {
      "id": "order",
      "type": "backend",
      "label": "Order service",
      "pos": [
        490,
        300
      ],
      "size": [
        220,
        110
      ],
      "tile": true,
      "sublabel": "gRPC client"
    },
    {
      "id": "payment",
      "type": "backend",
      "label": "Payment service",
      "pos": [
        920,
        300
      ],
      "size": [
        220,
        110
      ],
      "tile": true,
      "sublabel": "gRPC server"
    }
  ],
  "connections": [
    {
      "id": "e-req",
      "from": "client",
      "to": "order",
      "label": "REST · JSON",
      "fromSide": "right",
      "toSide": "left",
      "variant": "emphasis"
    },
    {
      "id": "e-rpc",
      "from": "order",
      "to": "payment",
      "label": "gRPC · HTTP/2 · Protobuf",
      "fromSide": "right",
      "toSide": "left",
      "variant": "emphasis"
    },
    {
      "id": "e-res",
      "from": "payment",
      "to": "order",
      "label": "result",
      "fromSide": "bottom",
      "toSide": "bottom"
    },
    {
      "id": "e-resp",
      "from": "order",
      "to": "client",
      "label": "REST response",
      "fromSide": "bottom",
      "toSide": "bottom"
    }
  ]
}