{
  "schema_version": 1,
  "diagram_type": "architecture",
  "meta": {
    "title": "Load Balancer: Realistic Use Cases",
    "subtitle": "Six jobs a load balancer does beyond simple traffic distribution",
    "output": "load-balancer-usecases.html",
    "quality_profile": "showcase",
    "animation": "trace"
  },
  "components": [
    { "id": "mobile-users", "type": "external", "label": "Mobile Users", "sublabel": "iOS / Android app", "pos": [40, 150], "size": [150, 90], "tile": true, "note": "Traffic from the native mobile app. The load balancer routes these requests to a backend pool tuned for mobile payloads." },
    { "id": "desktop-users", "type": "external", "label": "Desktop Users", "sublabel": "Web browser", "pos": [40, 400], "size": [150, 90], "tile": true, "note": "Traffic from the desktop web app. Routed to a separate pool that serves full HTML pages instead of the mobile API responses." },
    { "id": "returning-user", "type": "external", "label": "Returning User", "sublabel": "Same session cookie", "pos": [40, 650], "size": [150, 90], "tile": true, "note": "A user with an existing session cookie. The load balancer honors sticky sessions and pins their requests back to the same instance." },

    { "id": "session-store", "type": "database", "label": "Session Store", "sublabel": "Sticky session map", "pos": [340, 20], "size": [170, 90], "tile": true, "note": "Tracks which backend instance owns each session, so the load balancer can consistently pin a returning user to the same server instead of load-balancing them elsewhere." },

    { "id": "lb", "type": "cloud", "label": "Load Balancer", "sublabel": "Layer 7 · HTTPS :443", "pos": [340, 400], "size": [170, 100], "tag": "SSL Termination", "tile": true, "note": "The central traffic distributor. Terminates inbound HTTPS, routes by platform, consults health status, and enforces session affinity before forwarding to a backend pool." },

    { "id": "health-checker", "type": "security", "label": "Health Checker", "sublabel": "Periodic instance probes", "pos": [340, 660], "size": [170, 90], "tile": true, "note": "Periodically probes every backend instance. An instance that stops responding correctly is marked unhealthy and excluded from routing until it recovers." },

    { "id": "mobile-pool", "type": "backend", "label": "Mobile API Pool", "sublabel": "Optimized backend", "pos": [660, 150], "size": [160, 90], "tile": true, "note": "A backend pool optimized for mobile API traffic: lighter payloads and endpoints tailored to the mobile app, backed by Zone A instances." },
    { "id": "web-pool", "type": "backend", "label": "Web App Pool", "sublabel": "Full-page backend", "pos": [660, 400], "size": [160, 90], "tile": true, "note": "A backend pool that renders full web pages for the desktop app, backed by Zone B instances." },

    { "id": "instance-a1", "type": "backend", "label": "Instance A1", "sublabel": "Zone A · healthy", "pos": [990, 70], "size": [150, 90], "tile": true, "icon": "messagebus", "note": "A healthy server instance in Availability Zone A. Currently pinned as the sticky-session target for returning users tracked in the Session Store." },
    { "id": "instance-a2", "type": "backend", "label": "Instance A2", "sublabel": "Zone A · healthy", "pos": [990, 170], "size": [150, 90], "tile": true, "icon": "messagebus", "note": "A healthy server instance in Availability Zone A, actively receiving traffic from the Mobile API Pool." },
    { "id": "instance-a3", "type": "backend", "label": "Instance A3", "sublabel": "Zone A · unhealthy", "pos": [990, 270], "size": [150, 90], "tag": "removed from rotation", "tile": true, "icon": "messagebus", "note": "Failed its last health probe. The load balancer has excluded it from rotation so no traffic reaches it until it passes a probe again." },

    { "id": "instance-b1", "type": "backend", "label": "Instance B1", "sublabel": "Zone B · healthy", "pos": [990, 440], "size": [150, 90], "tile": true, "icon": "messagebus", "note": "A healthy server instance in Availability Zone B, serving full-page requests from the Web App Pool." },
    { "id": "instance-b2", "type": "backend", "label": "Instance B2", "sublabel": "Zone B · healthy", "pos": [990, 540], "size": [150, 90], "tile": true, "icon": "messagebus", "note": "A healthy server instance in Availability Zone B, providing capacity in a second zone for resilience if Zone A degrades." }
  ],
  "boundaries": [
    { "kind": "region", "label": "Availability Zone A", "wraps": ["instance-a1", "instance-a2", "instance-a3"] },
    { "kind": "region", "label": "Availability Zone B", "wraps": ["instance-b1", "instance-b2"] }
  ],
  "connections": [
    { "id": "mobile-to-lb", "from": "mobile-users", "to": "lb", "label": "HTTPS request", "variant": "security" },
    { "id": "desktop-to-lb", "from": "desktop-users", "to": "lb", "label": "HTTPS request", "variant": "security" },
    { "id": "returning-to-lb", "from": "returning-user", "to": "lb", "label": "request + session cookie", "variant": "dashed" },

    { "id": "lb-to-health", "from": "lb", "to": "health-checker", "label": "consult health status", "fromSide": "bottom", "toSide": "top" },
    { "id": "lb-to-session", "from": "lb", "to": "session-store", "label": "lookup / persist affinity", "fromSide": "top", "toSide": "bottom" },

    { "id": "lb-to-mobile-pool", "from": "lb", "to": "mobile-pool", "label": "platform-specific routing", "fromSide": "right", "toSide": "left" },
    { "id": "lb-to-web-pool", "from": "lb", "to": "web-pool", "label": "platform-specific routing", "fromSide": "right", "toSide": "left" },

    { "id": "mobile-pool-to-a1", "from": "mobile-pool", "to": "instance-a1" },
    { "id": "mobile-pool-to-a2", "from": "mobile-pool", "to": "instance-a2" },

    { "id": "web-pool-to-b1", "from": "web-pool", "to": "instance-b1" },
    { "id": "web-pool-to-b2", "from": "web-pool", "to": "instance-b2" },

    { "id": "health-check-a3", "from": "health-checker", "to": "instance-a3", "label": "probe: failed → excluded", "variant": "dashed", "fromSide": "bottom", "toSide": "right", "via": [[425, 790], [1200, 790], [1200, 315]] },
    { "id": "session-to-a1", "from": "session-store", "to": "instance-a1", "label": "pinned server", "variant": "emphasis" }
  ],
  "cards": [
    { "dot": "cyan", "title": "Failure handling", "items": ["Traffic is automatically redirected away from a malfunctioning instance (A3) to keep the service continuously available."] },
    { "dot": "emerald", "title": "Instance health checks", "items": ["The load balancer continuously polls instance health and only routes to servers that report healthy."] },
    { "dot": "violet", "title": "Platform-specific routing", "items": ["Mobile and desktop requests are routed to specialized backend pools so each device type gets a tailored response."] },
    { "dot": "rose", "title": "SSL termination", "items": ["The load balancer decrypts inbound HTTPS traffic, offloading TLS work from backend instances."] },
    { "dot": "amber", "title": "Cross-zone load balancing", "items": ["Requests can be distributed across Availability Zone A and Zone B, improving resilience beyond a single zone."] },
    { "dot": "slate", "title": "User stickiness", "items": ["A returning user's requests are consistently pinned to the same backend instance to preserve session state."] }
  ]
}
