{
  "schema_version": 1,
  "diagram_type": "architecture",
  "meta": {
    "title": "Bước 2-4: từ REST call đến bytes",
    "output": ".archify/youtube/grpc-how-it-works-20260930-164021/1-stub-protobuf/stub-protobuf.html",
    "quality_profile": "showcase",
    "animation": "trace",
    "viewBox": [
      1200,
      760
    ],
    "legend": {
      "mode": "hidden"
    }
  },
  "components": [
    {
      "id": "client",
      "type": "frontend",
      "label": "Client",
      "pos": [
        35,
        330
      ],
      "size": [
        150,
        100
      ],
      "tile": true
    },
    {
      "id": "order",
      "type": "backend",
      "label": "Order service",
      "pos": [
        280,
        330
      ],
      "size": [
        150,
        100
      ],
      "tile": true,
      "sublabel": "gRPC client"
    },
    {
      "id": "stub",
      "type": "backend",
      "label": "gRPC stub",
      "pos": [
        525,
        330
      ],
      "size": [
        150,
        100
      ],
      "tile": true,
      "sublabel": "payment.charge()"
    },
    {
      "id": "protobuf",
      "type": "backend",
      "label": "Protobuf",
      "pos": [
        770,
        330
      ],
      "size": [
        150,
        100
      ],
      "tile": true,
      "sublabel": "binary encode"
    },
    {
      "id": "transport",
      "type": "cloud",
      "label": "HTTP/2",
      "pos": [
        1015,
        330
      ],
      "size": [
        150,
        100
      ],
      "tile": true,
      "sublabel": "transport"
    }
  ],
  "connections": [
    {
      "id": "e-rest",
      "from": "client",
      "to": "order",
      "label": "REST call",
      "fromSide": "right",
      "toSide": "left"
    },
    {
      "id": "e-call",
      "from": "order",
      "to": "stub",
      "label": "local call",
      "fromSide": "right",
      "toSide": "left"
    },
    {
      "id": "e-ser",
      "from": "stub",
      "to": "protobuf",
      "label": "serialize",
      "fromSide": "right",
      "toSide": "left",
      "variant": "emphasis"
    },
    {
      "id": "e-bytes",
      "from": "protobuf",
      "to": "transport",
      "label": "bytes",
      "fromSide": "right",
      "toSide": "left"
    }
  ]
}