{
 "schema_version": 1,
 "diagram_type": "architecture",
 "meta": {
  "title": "Stickiness and Cross-Zone",
  "subtitle": "Same user, same server",
  "output": "3-stickiness.html",
  "quality_profile": "showcase",
  "animation": "trace",
  "viewBox": [
   400,
   711
  ]
 },
 "components": [
  {
   "id": "returning",
   "type": "external",
   "label": "Returning User",
   "sublabel": "Same session cookie",
   "pos": [
    95,
    40
   ],
   "size": [
    210,
    100
   ],
   "tile": true,
   "note": "A user with an existing session cookie."
  },
  {
   "id": "lb",
   "type": "cloud",
   "label": "Load Balancer",
   "sublabel": "Layer 7 · HTTPS :443",
   "pos": [
    95,
    240
   ],
   "size": [
    210,
    110
   ],
   "tile": true,
   "note": "Terminates inbound HTTPS, routes each request by platform, skips unhealthy instances and keeps returning users on the same server."
  },
  {
   "id": "session",
   "type": "database",
   "label": "Session Store",
   "sublabel": "sticky session map",
   "pos": [
    20,
    470
   ],
   "size": [
    170,
    100
   ],
   "tile": true,
   "note": "Tracks which instance owns each session so the load balancer can pin a returning user back to it."
  },
  {
   "id": "zone-b",
   "type": "backend",
   "label": "Zone B",
   "sublabel": "2 instances · healthy",
   "pos": [
    210,
    470
   ],
   "size": [
    170,
    100
   ],
   "tile": true,
   "note": "Availability Zone B: gives cross-zone capacity if Zone A degrades.",
   "icon": "messagebus"
  },
  {
   "id": "a1",
   "type": "backend",
   "label": "Instance A1",
   "sublabel": "Zone A · healthy",
   "pos": [
    20,
    620
   ],
   "size": [
    170,
    90
   ],
   "tile": true,
   "note": "The instance this user is pinned to, in Zone A.",
   "icon": "messagebus"
  }
 ],
 "connections": [
  {
   "id": "r-lb",
   "from": "returning",
   "to": "lb",
   "label": "cookie",
   "variant": "dashed"
  },
  {
   "id": "lb-session",
   "from": "lb",
   "to": "session",
   "label": "lookup"
  },
  {
   "id": "lb-zb",
   "from": "lb",
   "to": "zone-b",
   "label": "cross-zone"
  },
  {
   "id": "session-a1",
   "from": "session",
   "to": "a1",
   "label": "pinned",
   "variant": "emphasis"
  }
 ],
 "cards": [
  {
   "dot": "slate",
   "title": "User stickiness",
   "items": [
    "A returning user's requests are pinned to the same instance to keep session state."
   ]
  },
  {
   "dot": "amber",
   "title": "Cross-zone balancing",
   "items": [
    "Requests can also be spread across Zone A and Zone B for resilience."
   ]
  }
 ]
}